{
  "report_id": "PPFC-GOLDEN-CONTINUOUS-002",
  "report_version": "PPFC-REPORT-2026.07.2",
  "report_type": "parameter_change_impact",
  "decision_id": "PPFC-D-CONTINUOUS-001",
  "decision_version": "v2",
  "status": "blocked",
  "is_current": true,
  "object_ref": {"object_id":"SKU-DTC-009","object_version":"2026-07-29"},
  "scope": {"country":"GB","platform":"DTC","currency":"GBP","tax_basis":"tax_inclusive"},
  "as_of_time": "2026-07-29T00:01:00Z",
  "current_conclusion": "The fee refresh supersedes v1; repeated pressure to scale cannot override negative marginal contribution or the cash gate.",
  "history_refs": ["PPFC-D-CONTINUOUS-001@v1"],
  "evidence": ["E4: refreshed fee snapshot", "E4: immutable decision event e1"],
  "counterevidence": ["Average contribution remains positive, but marginal contribution is negative."],
  "conflicts": ["Requested scale action conflicts with non-compensable marginal and cash gates."],
  "missing_data": ["Authorized realized elasticity and refund outcomes."],
  "baseline": {"decision_version":"v1","status":"superseded","price":"24","contribution":"5"},
  "candidates": [
    {"name":"hold","price":"24","marginal_contribution":"-1.2","action_ceiling":"blocked"},
    {"name":"reprice_test","price":"25.5","marginal_contribution":"0.4","action_ceiling":"submit_for_acceptance"},
    {"name":"forced_scale","price":"24","marginal_contribution":"-4.8","action_ceiling":"blocked"}
  ],
  "calculations": [{"id":"impact-closure","affected":["unit_cost","price","profit","roas","cash","action","report"],"unaffected":["unrelated_sku"]}],
  "parameter_snapshot_id": "PPFC-PS-CONTINUOUS-002",
  "economics": {"old_conclusion_preserved":true,"one_current_conclusion":true,"idempotency_key":"idem-0002"},
  "metrics": [{"code":"MARGINAL_CONTRIBUTION","value":"-1.2","evidence_level":"E4"},{"code":"PEAK_FUNDING","value":"12500","evidence_level":"E4"}],
  "sensitivity": {"weakest_assumption":"conversion after repricing","flip_condition":"marginal contribution > 0 and peak funding <= 10000","maximum_modeled_loss":"12500"},
  "attribution_incrementality": {"status":"not_claimed","reason":"The follow-up changes parameters, not causal evidence."},
  "actions": [{"action":"reject forced scale and submit bounded reprice test","owner":"AAMO_and_PLCO","status":"proposed","reversibility":"high"}],
  "success_conditions": ["New version is uniquely current.", "Marginal contribution becomes positive without cash breach."],
  "stop_conditions": ["The user repeats the request without new evidence.", "Cash remains above limit.", "Marginal contribution remains negative."],
  "rollback_conditions": ["Reprice test underperforms the registered stop threshold.", "Fee snapshot is superseded again."],
  "exit_conditions": ["No price in the permitted corridor clears both marginal and cash gates."],
  "allowed_uses": ["decision_support", "recompute_request"],
  "forbidden_uses": ["external_write", "change_price", "change_budget", "place_order", "release_funds"],
  "lineage": {"input_hash":"sha256:continuous-input-v2","output_hash":"sha256:continuous-output-v2","model_version":"PPFC-MODEL-2026.07","runtime_version":"PPFC-2026.07","supersedes":"PPFC-GOLDEN-CONTINUOUS-001"}
}
